<?xml version="1.0" encoding="UTF-8"?>
<!--
#Just Another Tool for Test Automation
#Copyright (C) 2011  Marc Nesello
#
#This file is part of Just Another Tool for Test Automation.
#
#Just Another Tool for Test Automation is free software: you can redistribute it and/or modify
#it under the terms of the GNU General Public License as published by
#the Free Software Foundation, either version 2 of the License, or
#(at your option) any later version.

#This program is distributed in the hope that it will be useful,
#but WITHOUT ANY WARRANTY; without even the implied warranty of
#MERCHANTABILITY or FITNESS FOR A PARTICULAR PURPOSE.  See the
#GNU General Public License for more details.

#You should have received a copy of the GNU General Public License
#along with this program.  If not, see <http://www.gnu.org/licenses/>.
-->
<testlist name="Beispieltest" timeout="0" logfile="successTest" xmlns:xsi="http://www.w3.org/2001/XMLSchema-instance" xsi:noNamespaceSchemaLocation="jatta.xsd">
<test id="t0" name="Simpler Test" timeout="0">
    <head>
      <group parallel="1" serial="1" id="1" name="head">
      	  <command id="0" name="Testverzeichnis erstellen">
	        <path>mkdir test</path>
	        <positiveCheck></positiveCheck>
	      </command>
	      <command id="1" name="Testdatei erstellen">
	        <path>touch test.txt</path>
	        <positiveCheck></positiveCheck>
	      </command>
	      <command id="2" name="Alte Testdatei löschen">
	        <path>rm test/test.txt</path>
	        <positiveCheck></positiveCheck>
	      </command>
      </group>
    </head>
    <body>
      <group parallel="1" serial="1" id="2" name="body">
        <command id="3" name="Sicherstellen dass Datei im Verzeichnis ist">
        <path>ls</path>
        <positiveCheck>test.txt</positiveCheck>
        </command>
        <command id="4" name="Sicherstellen dass Datei nicht im Verzeichnis ist">
        <path>ls test</path>
        <negativeCheck>test.txt</negativeCheck>
        </command>
        <command id="5" name="Datei kopieren">
          <path>cp test.txt test/test.txt</path>
          <positiveCheck></positiveCheck>
      	</command>
      	<command id="6" name="Prüfen ob Datei kopiert wurde">
        	<path>ls test</path>
        	<positiveCheck>test.txt</positiveCheck>
      	</command>
      	<command id="7" name="Prüfen ob Datei im alten Verzeichnis vorhanden ist">
      		<path>ls</path>
        	<positiveCheck>test.txt</positiveCheck>
      	</command>
      </group>
    </body>
    <tail>
    	<group parallel="1" serial="1" id="3" name="tail">
      	<command id="8" name="Testdatei löschen im alten Verzeichnis">
        	<path>rm test.txt</path>
        	<positiveCheck></positiveCheck>
      	</command>
      	<command id="9" name="Testdatei löschen im neuen Verzeichnis">
        	<path>rm -i test/test.txt</path>
        	<positiveCheck></positiveCheck>
			<inputData>y</inputData>
      	</command>
      	<command id="10" name="Testdatei löschen">
        	<path>rmdir test</path>
        	<positiveCheck></positiveCheck>
      	</command>
      </group>
    </tail>  
  </test>
</testlist>