<?xml version="1.0" encoding="UTF-8"?>
<!--
#Just Another Tool for Test Automation
#Copyright (C) 2011  Marc Nesello
#
#This file is part of Just Another Tool for Test Automation.
#
#Just Another Tool for Test Automation is free software: you can redistribute it and/or modify
#it under the terms of the GNU General Public License as published by
#the Free Software Foundation, either version 2 of the License, or
#(at your option) any later version.

#This program is distributed in the hope that it will be useful,
#but WITHOUT ANY WARRANTY; without even the implied warranty of
#MERCHANTABILITY or FITNESS FOR A PARTICULAR PURPOSE.  See the
#GNU General Public License for more details.

#You should have received a copy of the GNU General Public License
#along with this program.  If not, see <http://www.gnu.org/licenses/>.
-->
<testlist name="Test cpanp" timeout="500" logfile="cpanp" xmlns:xsi="http://www.w3.org/2001/XMLSchema-instance" xsi:noNamespaceSchemaLocation="jatta.xsd">
<test id="t0" name="Install perl module xml::simple with cpanp" timeout="300">
    <head>
    </head>
    <body>
      <group id="1" name="install module">
        <command id="3" name="Call cpanp and install module">
        	<path>cpanp i XML::Simple</path>
        	<positiveCheck>No errors installing all modules</positiveCheck>
		<positiveCheck>Module 'XML::Simple' installed successfully</positiveCheck>
		<negativeCheck>ERROR</negativeCheck>
        </command>
      </group>
    </body>
    <tail>
    </tail>  
  </test>
 <test id="t1" name="Uninstall perl module xml::simple with cpanp" timeout="300">
    <head>
    </head>
    <body>
      <group id="1" name="uninstall module">
        <command id="3" name="Call cpanp and uninstall module">
		<!--Ein Kommentar: Blabla-->
        	<path>cpanp u XML::Simple --force</path>
        	<positiveCheck>Module 'XML::Simple' uninstalled successfully</positiveCheck>
		<positiveCheck>All modules uninstalled successfully</positiveCheck>
		<negativeCheck>ERROR</negativeCheck>
        </command>
      </group>
    </body>
    <tail>
    </tail>  
  </test>
</testlist>
