<?xml version="1.0" encoding="UTF-8"?>
<!--
#Just Another Tool for Test Automation
#Copyright (C) 2011  Marc Nesello
#
#This file is part of Just Another Tool for Test Automation.
#
#Just Another Tool for Test Automation is free software: you can redistribute it and/or modify
#it under the terms of the GNU General Public License as published by
#the Free Software Foundation, either version 2 of the License, or
#(at your option) any later version.

#This program is distributed in the hope that it will be useful,
#but WITHOUT ANY WARRANTY; without even the implied warranty of
#MERCHANTABILITY or FITNESS FOR A PARTICULAR PURPOSE.  See the
#GNU General Public License for more details.

#You should have received a copy of the GNU General Public License
#along with this program.  If not, see <http://www.gnu.org/licenses/>.
-->
<testlist name="Try to install ksh and uninstall it with aptsh" timeout="500" logfile="aptsh" xmlns:xsi="http://www.w3.org/2001/XMLSchema-instance" xsi:noNamespaceSchemaLocation="jatta.xsd">
<test id="test1" name="Install ksh" timeout="0">
<head>
</head>
    <body>
      <group parallel="1" serial="1" id="1" name="Install ksh">
        <command id="0" name="Check if ksh is installed">
       		<path>apt-cache policy ksh</path>
		<positiveCheck>Installiert: \(keine\)</positiveCheck>
        	<negativeCheck>(E|e)rror</negativeCheck>
        </command>
        <command id="1" name="Call aptsh and install ksh">
        	<path>aptsh</path>
        	<inputData>install ksh</inputData>
        	<inputData>quit</inputData>
		<positiveCheck>Richte ksh ein</positiveCheck>
        	<negativeCheck>(E|e)rror</negativeCheck>
        </command>
        <command id="2" name="Check if ksh is installed">
        	<path>apt-cache policy ksh</path>
		<positiveCheck>Installiert: \d+</positiveCheck>
        	<negativeCheck>(E|e)rror</negativeCheck>
        </command>

      </group>
    </body>
<tail></tail>
  </test>
<test id="test2" name="Uninstall ksh" timeout="0">
<head>
</head>
    <body>
      <group parallel="1" serial="1" id="1" name="Uninstall ksh">
        <command id="0" name="Check if ksh is installed">
       		<path>apt-cache policy ksh</path>
		<positiveCheck>Installiert: \d+</positiveCheck>
        	<negativeCheck>(E|e)rror</negativeCheck>
        </command>
        <command id="1" name="Call aptsh and uninstall ksh">
        	<path>aptsh</path>
        	<inputData>remove ksh</inputData>
        	<inputData>J</inputData>
        	<inputData>quit</inputData>
		<positiveCheck>Entferne ksh</positiveCheck>
        	<negativeCheck>(E|e)rror</negativeCheck>
        </command>
        <command id="2" name="Check if ksh is installed">
        	<path>apt-cache policy ksh</path>
		<positiveCheck>Installiert: \(keine\)</positiveCheck>
        	<negativeCheck>(E|e)rror</negativeCheck>
        </command>
      </group>
    </body>
<tail></tail>
  </test>
 
</testlist>
